{
  "$schema": "http://json-schema.org/draft-07/schema#",
  "title": "Component Registry (v3 sectioned structure)",
  "description": "Mirrors RawComponentRegistry (src/types/components.ts): components live in per-category top-level sections, not the pre-v3 unified 'components' map this schema used to describe. Deliberately SHALLOW below the section level: per-entry field vocabularies are enforced by tests/templates/type-json-alignment-stacks-components.test.ts against the TS interfaces, and this schema enforces the structure that actually drifted — the root shape. (The old schema was also unparseable JSON — a trailing comma — so it had never validated anything.)",
  "type": "object",
  "additionalProperties": false,
  "required": ["version", "frontends", "backends", "dependencies"],
  "properties": {
    "$schema": {
      "type": "string",
      "description": "Pointer to this schema (editor tooling)"
    },
    "version": {
      "type": "string",
      "description": "Registry format version (3.x = sectioned structure)"
    },
    "infrastructure": { "$ref": "#/definitions/componentSection" },
    "frontends": { "$ref": "#/definitions/componentSection" },
    "backends": { "$ref": "#/definitions/componentSection" },
    "mesh": { "$ref": "#/definitions/componentSection" },
    "appBuilder": { "$ref": "#/definitions/componentSection" },
    "dependencies": { "$ref": "#/definitions/componentSection" },
    "integrations": { "$ref": "#/definitions/componentSection" },
    "addons": { "$ref": "#/definitions/componentSection" },
    "tools": { "$ref": "#/definitions/componentSection" },
    "services": {
      "type": "object",
      "additionalProperties": { "type": "object" }
    },
    "envVars": {
      "type": "object",
      "description": "Keyed env-var definitions; the record key IS the env var name (EnvVarDefinition gains `key` at load via withEnvVarKeys)",
      "additionalProperties": {
        "type": "object",
        "required": ["label"],
        "properties": {
          "label": { "type": "string" }
        }
      }
    },
    "selectionGroups": {
      "type": "object",
      "description": "Exactly the groups RawComponentRegistry declares and ComponentRegistryManager reads. Four dead groups (stacks/brands/addons/tools) grew here once with no consumer; additionalProperties:false is what stops that recurring.",
      "additionalProperties": false,
      "properties": {
        "frontends": { "$ref": "#/definitions/idList" },
        "backends": { "$ref": "#/definitions/idList" },
        "dependencies": { "$ref": "#/definitions/idList" },
        "integrations": { "$ref": "#/definitions/idList" }
      }
    }
  },
  "definitions": {
    "componentSection": {
      "type": "object",
      "description": "Record of component id -> definition. Entries validated shallowly here (name required, everything else per RawComponentDefinition via the alignment tests).",
      "additionalProperties": {
        "type": "object",
        "required": ["name"],
        "properties": {
          "name": { "type": "string" },
          "description": { "type": "string" }
        }
      }
    },
    "idList": {
      "type": "array",
      "items": { "type": "string" }
    }
  }
}
