{
    "$schema": "./components.schema.json",
    "version": "3.0.0",

    "infrastructure": {
        "adobe-cli": {
            "name": "Adobe I/O CLI & SDK",
            "description": "Command-line interface and SDK for Adobe I/O services",
            "configuration": {
                "nodeVersion": "24"
            }
        }
    },

    "frontends": {
        "eds-storefront": {
            "name": "EDS Storefront",
            "description": "EDS storefront with Commerce Drop-in components",
            "icon": {
                "light": "adobe-file-icon-light.svg",
                "dark": "adobe-file-icon-dark.svg"
            },
            "configuration": {
                "requiredEnvVars": [],
                "optionalEnvVars": [
                    "MESH_ENDPOINT",
                    "AEM_ASSETS_ENABLED"
                ],
                "configFiles": {
                    ".env": {
                        "format": "env"
                    },
                    "config.json": {
                        "format": "json",
                        "generator": "eds-config"
                    }
                },
                "skipNpmInstall": true
            },
            "metadata": {
                "previewUrl": null,
                "liveUrl": null,
                "repoUrl": null,
                "githubRepo": null,
                "daLiveOrg": null,
                "daLiveSite": null,
                "templateOwner": null,
                "templateRepo": null,
                "contentSource": null
            },
            "compatibleBackends": ["adobe-commerce-paas", "adobe-commerce-accs"],
            "dependencies": {
                "required": [],
                "optional": []
            }
        },
        "headless": {
            "name": "Headless Storefront",
            "description": "Next.js-based headless storefront with Adobe mesh integration",
            "icon": {
                "light": "nextjs-file-icon-light.svg",
                "dark": "nextjs-file-icon-dark.svg"
            },
            "configuration": {
                "nodeVersion": "24",
                "requiredEnvVars": [
                    "ADOBE_COMMERCE_URL",
                    "ADOBE_COMMERCE_ENVIRONMENT_ID",
                    "ADOBE_COMMERCE_STORE_VIEW_CODE",
                    "ADOBE_COMMERCE_WEBSITE_CODE",
                    "ADOBE_COMMERCE_STORE_CODE",
                    "ADOBE_CATALOG_API_KEY"
                ],
                "optionalEnvVars": ["MESH_ENDPOINT", "ADOBE_ASSETS_URL"]
            },
            "compatibleBackends": ["adobe-commerce-paas", "adobe-commerce-accs"],
            "dependencies": {
                "required": [],
                "optional": []
            }
        }
    },

    "backends": {
        "adobe-commerce-paas": {
            "name": "Adobe Commerce PaaS",
            "description": "Adobe Commerce DSN instance",
            "configuration": {
                "commerce": {
                    "flavor": "paas",
                    "baseUrlKey": "ADOBE_COMMERCE_URL"
                },
                "requiredServices": ["catalog-service", "live-search"],
                "requiredEnvVars": [
                    "ADOBE_COMMERCE_URL",
                    "ADOBE_COMMERCE_GRAPHQL_ENDPOINT",
                    "PAAS_CATALOG_SERVICE_ENDPOINT",
                    "ADOBE_COMMERCE_ADMIN_USERNAME",
                    "ADOBE_COMMERCE_ADMIN_PASSWORD",
                    "ADOBE_COMMERCE_WEBSITE_CODE",
                    "ADOBE_COMMERCE_STORE_CODE",
                    "ADOBE_COMMERCE_STORE_VIEW_CODE",
                    "ADOBE_COMMERCE_ENVIRONMENT_ID",
                    "ADOBE_CATALOG_API_KEY"
                ],
                "optionalEnvVars": ["ADOBE_COMMERCE_ADMIN_URL"]
            }
        },
        "adobe-commerce-accs": {
            "name": "Adobe Commerce Cloud Service",
            "description": "Adobe's managed SaaS commerce backend",
            "configuration": {
                "commerce": {
                    "flavor": "saas",
                    "baseUrlKey": "ACCS_GRAPHQL_ENDPOINT",
                    "baseUrlStripSuffix": "/graphql"
                },
                "providesServices": ["catalog-service", "live-search"],
                "requiredEnvVars": [
                    "ACCS_GRAPHQL_ENDPOINT",
                    "ACCS_WEBSITE_CODE",
                    "ACCS_STORE_CODE",
                    "ACCS_STORE_VIEW_CODE"
                ],
                "optionalEnvVars": ["ACCS_OAUTH_CLIENT_ID", "ACCS_OAUTH_CLIENT_SECRET"]
            }
        }
    },

    "mesh": {
        "eds-commerce-mesh": {
            "name": "EDS Commerce API Mesh",
            "subType": "mesh",
            "description": "Passthrough GraphQL mesh for EDS storefronts with dropin components (no prefixes)",
            "icon": {
                "light": "adobe-file-icon-light.svg",
                "dark": "adobe-file-icon-dark.svg"
            },
            "source": {
                "type": "git",
                "url": "https://github.com/skukla/commerce-eds-mesh",
                "gitOptions": {
                    "shallow": true,
                    "tag": "stable"
                }
            },
            "configuration": {
                "nodeVersion": "24",
                "buildScript": "build",
                "requiresDeployment": true,
                "deploymentTarget": "adobe-io",
                "requiredEnvVars": [
                    "ADOBE_COMMERCE_GRAPHQL_ENDPOINT",
                    "ADOBE_COMMERCE_URL",
                    "ADOBE_COMMERCE_ENVIRONMENT_ID",
                    "ADOBE_COMMERCE_STORE_VIEW_CODE",
                    "ADOBE_COMMERCE_WEBSITE_CODE",
                    "ADOBE_COMMERCE_STORE_CODE",
                    "ADOBE_CATALOG_API_KEY",
                    "ADOBE_CATALOG_SERVICE_ENDPOINT"
                ],
                "providesEnvVars": ["MESH_ENDPOINT"]
            }
        },
        "eds-accs-mesh": {
            "name": "EDS ACCS API Mesh",
            "subType": "mesh",
            "description": "GraphQL mesh for EDS storefronts with ACCS backend (single source passthrough)",
            "icon": {
                "light": "adobe-file-icon-light.svg",
                "dark": "adobe-file-icon-dark.svg"
            },
            "source": {
                "type": "git",
                "url": "https://github.com/skukla/eds-accs-mesh",
                "gitOptions": {
                    "shallow": true,
                    "tag": "stable"
                }
            },
            "configuration": {
                "nodeVersion": "24",
                "buildScript": "build",
                "requiresDeployment": true,
                "deploymentTarget": "adobe-io",
                "requiredEnvVars": [
                    "ACCS_GRAPHQL_ENDPOINT",
                    "ACCS_WEBSITE_CODE",
                    "ACCS_STORE_CODE",
                    "ACCS_STORE_VIEW_CODE"
                ],
                "optionalEnvVars": [],
                "providesEnvVars": ["MESH_ENDPOINT"]
            }
        },
        "headless-commerce-mesh": {
            "name": "Headless Commerce API Mesh",
            "subType": "mesh",
            "description": "Prefixed/namespaced GraphQL mesh for Next.js headless storefronts",
            "icon": {
                "light": "adobe-file-icon-light.svg",
                "dark": "adobe-file-icon-dark.svg"
            },
            "source": {
                "type": "git",
                "url": "https://github.com/skukla/headless-commerce-mesh",
                "gitOptions": {
                    "shallow": true,
                    "tag": "stable"
                }
            },
            "configuration": {
                "nodeVersion": "24",
                "buildScript": "build",
                "requiresDeployment": true,
                "deploymentTarget": "adobe-io",
                "requiredEnvVars": [
                    "ADOBE_COMMERCE_GRAPHQL_ENDPOINT",
                    "ADOBE_COMMERCE_URL",
                    "ADOBE_COMMERCE_ENVIRONMENT_ID",
                    "ADOBE_COMMERCE_STORE_VIEW_CODE",
                    "ADOBE_COMMERCE_WEBSITE_CODE",
                    "ADOBE_COMMERCE_STORE_CODE",
                    "ADOBE_CATALOG_API_KEY",
                    "ADOBE_CATALOG_SERVICE_ENDPOINT"
                ],
                "providesEnvVars": ["MESH_ENDPOINT"]
            }
        }
    },

    "appBuilder": {},

    "dependencies": {},

    "integrations": {
        "experience-platform": {
            "name": "Experience Platform",
            "description": "Adobe Experience Platform integration via Commerce Data Sharing",
            "requiresApiKey": true,
            "endpoint": "https://platform.adobe.io",
            "configuration": {
                "requiredEnvVars": [
                    "EXPERIENCE_PLATFORM_DATASTREAM_ID",
                    "EXPERIENCE_PLATFORM_API_KEY"
                ]
            }
        }
    },

    "addons": {
        "adobe-commerce-aco": {
            "name": "Adobe Commerce Optimizer",
            "description": "Catalog optimization service for enhanced product discovery and merchandising",
            "configuration": {
                "providesServices": ["catalog-service", "live-search"],
                "requiredEnvVars": [
                    "ACO_API_URL",
                    "ACO_API_KEY",
                    "ACO_TENANT_ID",
                    "ACO_ENVIRONMENT_ID"
                ]
            }
        }
    },

    "tools": {
        "commerce-demo-ingestion": {
            "name": "Commerce Demo Ingestion",
            "description": "Tool for populating ACCS instances with demo data",
            "source": {
                "type": "git",
                "url": "https://github.com/PMET-public/commerce-demo-ingestion",
                "gitOptions": {
                    "shallow": true,